ID,CompanyName,Title,CompanyLocation,Salary,Summary
https://kr.indeed.com/viewjob?jk=af5683389907a8c9,크로스앵글,백엔드 개발자 (경력),서울 역삼동,,"데이터 관리 (Auth0) - 블록체인 지갑 인증 (Ethereum, EOS) [자격요건] - 백엔드 & Python 실무 개발경험 3년 이상 혹은 그에 준하는 능력을 갖고 있으신 분 - 새로운 기술에 대해 호기심을 갖고..."
https://kr.indeed.com/viewjob?jk=1dc94d41fd3f8c31,베스트핀,"2022년 상반기 경력직 [웹 프론트, IOS개발, 서비스기획, 금융상품관리, 퍼블리셔]",서울 영등포구,,인터넷·IT·통신·모바일·게임>응용프로그래머>인공지능(AI)|인터넷·IT·통신·모바일·게임>응용프로그래머> Python|인터넷·IT·통신·모바일·게임>응용프로그래머>증강현실(AR)|인터넷·IT·통신·모바일·게임>응용프로그래머...
https://kr.indeed.com/viewjob?jk=82336e9f5cdce72a,AIA,IFRS17 계리결산 담당자,서울,,"위한 데이터 처리 기술과 계리소프트웨어 사용 능력 **Prophet, 엑셀, VisualBasic, SQL, Python 등 - 계리 관련 자격증 보유자 선호 - IFRS17 업무 경험이 있는 자 선호 - 비즈니스 영어..."
https://kr.indeed.com/viewjob?jk=2fbc3ee06b32977a,Process Systems Enterprise Limited,Senior Consultant Engineer for Advanced Process Modelling Work - SPSE,대전,,"programming language would be useful... crucial Python, Visual Basic, VBA in Excel, Java, C Experience in data base..."
https://kr.indeed.com/viewjob?jk=bc95d3762cd18adb,쿠노소프트,인공지능 인력 초빙(신입 및 경력),서울 고려대역,"연봉 27,000,000원",및 개발 - 딥러닝 기반 영상처리 연구 및 개발 - Chatbot 엔진 연구 및 개발 ## 지원자격 - Python 기반의 Tensorflow 개발 (Pytorch 혹은 YOLO의 경우 option임) - Docker 및...
https://kr.indeed.com/viewjob?jk=1d45aac0ddac58a1,위메프,[위메프서비스] DBA,대한민국,,"Cloud 운영 경험을 가지고 계신 분 Linux, 네트워크 등 기본적인 인프라 지식을 가지고 계신 분 Python, Perl 등의 언어를 사용하여 프로그램 작성이 가능하신 분 원활한 커뮤니케이션이 가능하신 분 [전형..."
https://kr.indeed.com/viewjob?jk=cf405352d5f4d112,광주과학기술원,융합기술학제학부 인공지능연구실,광주 북구,,모집분야의 적격자가 없을 경우 임용하지 않을 수 있음 지원자격 구 분 주 요 내 용 지원자격 • Python 언어 프로그래밍 가능자 학 력 • 학사 이상 학위소지자 나이·성별 • 제한 없음 공통 결격사유...
https://kr.indeed.com/viewjob?jk=1d45aac0ddac58a1,위메프,[위메프서비스] DBA,대한민국,,"Cloud 운영 경험을 가지고 계신 분 Linux, 네트워크 등 기본적인 인프라 지식을 가지고 계신 분 Python, Perl 등의 언어를 사용하여 프로그램 작성이 가능하신 분 원활한 커뮤니케이션이 가능하신 분 [전형..."
https://kr.indeed.com/viewjob?jk=cf405352d5f4d112,광주과학기술원,융합기술학제학부 인공지능연구실,광주 북구,,모집분야의 적격자가 없을 경우 임용하지 않을 수 있음 지원자격 구 분 주 요 내 용 지원자격 • Python 언어 프로그래밍 가능자 학 력 • 학사 이상 학위소지자 나이·성별 • 제한 없음 공통 결격사유...
https://kr.indeed.com/viewjob?jk=c520df1ab9daf741,Success Korea,Data Engineer,서울,,"및 역량 - 클라우드 환경에서의 빅데이터 인프라 구축 및 플랫폼 운영 경험 - Java, Scala, Python 중 1개 이상의 언어로 능숙한 개발 가능 역량 - Hadoop 또는 AWS (EMR, MSK, Glue..."
https://kr.indeed.com/viewjob?jk=50d0ee7338ae4c1d,현대자동차그룹,"유무선 통신통합제어기 (CCU) SW 아키텍처 및 요소기술 개발[연구원, 책임연구원]",대한민국,,"경험 보유자 시스템 및 어플리케이션 기능 설계 및 개발 경험 보유자 Python, C/C++ 언어, 임베디드 관련 코딩 기술 보유자 C/C++, python/shell 개발 경험 보유자 alm (jira, confluence..."
https://kr.indeed.com/viewjob?jk=a91fe30fcf6aeb5e,위메프,[위메프서비스] Data Engineer,대한민국,,"우리가 사용하는 기술] 개발언어: Python, Java 하둡인프라... 분이에요] 데이터엔지니어 경력 3년 이상 보유하신 분 Java, Python 개발 능력을 보유하신 분(중급 이상) [이런 경험이 있으면 더 좋아..."
https://kr.indeed.com/viewjob?jk=529fb39bcf4d585c,에이치에스글로벌,[에이치에스글로벌] HW/SW 분야 직무 교육 전문강사,서울 강남구,,통신·모바일·게임>응용프로그래머>인공지능(AI)|인터넷·IT·통신·모바일·게임>빅데이터·AI(인공지능)> Python|인터넷·IT·통신·모바일·게임>빅데이터·AI(인공지능)>빅데이터|인터넷·IT·통신·모바일·게임>빅데이터·AI...
https://kr.indeed.com/viewjob?jk=6e89d435e3aa8872,Success Korea,연구개발_자연어 처리 부문,서울 역삼동,,"ChitChat - Document Grounded Conversation [자격요건] - Python, Java 등 언어 중 하나 이상 활용 가능하신 분 - TensorFlow/Keras, PyTorch 등 머신러닝..."
https://kr.indeed.com/viewjob?jk=e44a6678f361ff46,Appier,Machine Learning Consultant (A.I. Marketing Technology),서울,,online A/B testing problem. Fluency with scripting ( Python/etc). Enthusiasm to frame and solve real-world problems...
https://kr.indeed.com/viewjob?jk=116009dbf59211ed,주식회사퍼즐데이터,퍼즐데이터 역량있는 데이터 분석가,서울 역삼동,,"데이터 마이닝 및 통계분석에 대한 전반적인 이해 3. 관련분야(산업공학, 통계 등) 전공 4. R or Python 사용 능력 * 이런 분은 더욱 좋아요. 1. 프로세스 마이닝 지식 보유자 2. 관련분야 대학원 전공 3..."
https://kr.indeed.com/viewjob?jk=168e4adb0802141c,DZS,SW Test Engineer,경기도 성남,,"Python에 자동화 개발 계획, 실행 및 검토 - 제품 설계 및 검증 사이클 전반에 기술 설계 문서 검토 업무 참여 *지원자격 - Python... automated tests in Python for future use..."
https://kr.indeed.com/viewjob?jk=f3ef05060b371c15,Superb AI,Data Engineer,서울,,"준하는 5년 이상의 유사 업무 경험) 프로그래밍을 통한 업무 자동화 및 데이터 처리 경험(주 사용 언어: Python) 3년 이상 고객 중심적 사고방식, 사용자 경험 및 비즈니스에 대한 이해와 소통 능력 보유 AI 기술에..."
https://kr.indeed.com/viewjob?jk=973aaf4694768abc,BD,Business Data Analyst,서울,,"commercial team. Requirements Bachelor’s degree SQL, Python, Power BI is a must RPA, SFDC knowledge is a plus 0-3 years..."
https://kr.indeed.com/viewjob?jk=1b71fdc159c6f670,넷마블,DB 엔지니어(DBA) 모집,서울 구로구,,"있으신 분 (Redis, MongoDB, Aerospike) - 인터프리터 언어의 숙련도가 있으신 분 ( Python, Powershell, Shell) * 국가보훈대상자 및 장애인은 관련법령에 의거하여 우대합니다. * 서류..."
https://kr.indeed.com/viewjob?jk=476fb90686ec34ce,Coupang,Staff data analyst (Fresh SCM Autonomation),서울,,"Inventory redistribution optimization problem Utilize code ( Python, R, SQL etc... extracting, analyzing, and structuring..."
https://kr.indeed.com/viewjob?jk=1df0a09a83c23c14,ASML,CS Field Application Patterning Control Competency Engineer,대한민국,,"Sufficient knowledge to handle SW tools (MATLAB, C++, C#, Python, MS office and so... data analysis - Expertise in one..."
https://kr.indeed.com/viewjob?jk=902063d7640b2dd2,쓰리에이치굿스,[주식회사 쓰리에이치굿스]드론 하드웨어(HW) 제작 - 드론 프로그래머(SW),광주 대촌동,,"조건: 드론 1종 자격증 소지자 2) 소프트웨어 - 조건: C++. Python등 드론제어와 관련한 프로그램에 문제가 없는 분 - 업무: 계측용... 3) 빅데이터 - 조건: html, python 기반 webgl 사용가능..."
https://kr.indeed.com/viewjob?jk=5b3dfe3c5bfb578f,SAS,Associate Technical Support Engineer (Early Careers),서울,,"밍에 대한 학업 또는 업무 경험 또는 신기술 습득에 대한 적성 최대 경력 5년 이내 지원자 C, Java, Python, SAS 또는 3세대 또는 4세대 언어 프로그래밍 경험 어려운 문제를 해결하기 위한 기술 솔루션을 구축하..."
https://kr.indeed.com/viewjob?jk=e46e06b7abe78ae6,Canonical - Jobs,Software Engineer - Identity Management for Canonical Products,서울,,"software company. Bring your Python and Golang skills to bear on identity... clients, using Python (and optionally..."
https://kr.indeed.com/viewjob?jk=776ccceeaf6fe02e,대구경북과학기술원,DGIST 동반진단의료기술융합연구실 계약직 연구원 공개 채용 공고,대구 현풍면,,"경험자 Matlab 또는 Python 활용 능력 우수자 C/C++... 분석 수행 Python을 통한 Data 처리 및 DB 구축 윈도우/리눅스 환경 프로그래밍 가능자(C++, Java, Python 등) 자동..."
https://kr.indeed.com/viewjob?jk=4a2f90d3628f14a6,트릿지,DevOps Engineer,서울 서초구,,"및 마이크로서비스 아키텍처에 대한 지식을 보유하신 분- 자동화 및 스크립팅 기술을 보유하신 분 (BASH, python)- Linux 시스템 및 네트워킹 지식을 보유하신 분- Docker 및 컨테이너화 개념에 대한 이해도가..."
https://kr.indeed.com/viewjob?jk=032f661b27d39ebf,ZEISS Group,Fab Automation Engineer,경기도 화성,,"이상의 반도체/전자조립장비, 산업자동화/공정장비 경력보유자 (MES, SECS, GEM) 프로그래밍 언어( Python, C#, C++ and MATLAB) 사용에 능통한 자 비즈니스 레벨의 영어 가능자 Your ZEISS..."
https://kr.indeed.com/viewjob?jk=b6489bf6d28dea75,Broadcom,HW/EMI Engineer,서울,,"measurement automation programming competency preferred ( Python, C#, R) - Preference is given to those who have the ability..."
https://kr.indeed.com/viewjob?jk=7413ab9a269ef3bc,허니엠앤비,"IT(앱/웹) 개발 및 서비스 운영관리, IT R&D 외 경력",안산 단원구,,"고졸 이상ㆍ경력 : 앱/웹 개발 경력 2년 이상 ~ 5년 이하ㆍ Python, React-Native, Django 활용 가능자ㆍRest API에 대한... 웹프로그래머>백엔드|인터넷·IT·통신·모바일·게임>웹프로그래머> Python"
https://kr.indeed.com/viewjob?jk=fd9515607c22e137,경신,연구본부 수시채용,인천 송도동,,"Simulink)활용 모델링 경험자 *설계 관련 툴(CANoe, Trace32 등) 사용 가능자 *C/C++ / Python 프로그래밍 경험자 *SW 프로젝트 관리 경험자 인천 전장제어기 H/W설계 경력 0명 정규직..."
https://kr.indeed.com/viewjob?jk=90593106b662c960,BOEING,"Associate Software Engineer (Cloud Native Developer, Data Engineer/Dashboard Developer)",서울,,"Application SW optimization and debugging. Knowledge on Java, python, scala, spark, time-series database (like influxDB..."
https://kr.indeed.com/viewjob?jk=58b05a854f4768d7,현대자동차그룹,"AUTOSAR 기반 차량 전자시스템 SW 개발 및 검증[연구원, 책임연구원]",대한민국,,"기반으로 BDC 제어기 동작 기능 검증 프로그램 언어(C, C++, Python 등)와 Compiler 및 Debugger에 대한 이해를 기반으로... AUTOSAR, C/C++, Python, GIT(Bitbucket..."
https://kr.indeed.com/viewjob?jk=06ac5ee96c79b73d,피플케어코리아,"RF Test Engineer, Korea",인천,,"test solutions- Experience developing automated test systems in Python, C, C++- Knowledge of RF/Microwave test fundamentals..."
https://kr.indeed.com/viewjob?jk=ce97ef62c3073c4c,Menlo Security,Professional Service Consultant,서울,,"many different tasks simultaneously Scripting experience - Python, Powershell and Bash is preferred Demonstrated project..."
https://kr.indeed.com/viewjob?jk=41578d0283909f87,엠아이솔루션,"Android앱/웹 응용프로그램 개발 신입/경력 정규직, 계약직",대전 유성구,,응용프로그래머>iOS|인터넷·IT·통신·모바일·게임>응용프로그래머> Python|인터넷·IT·통신·모바일·게임>웹프로그래머>웹개발|인터넷·IT·통신... 통신·모바일·게임>웹프로그래머> Python|인터넷·IT·통신·모바일·게임...
https://kr.indeed.com/viewjob?jk=333dc2aca43cb4ba,이노피아테크,(주)이노피아테크 H/W개발 엔지니어 신입/경력,성남 중원구,,C++|인터넷·IT·통신·모바일·게임>응용프로그래머>JAVA|인터넷·IT·통신·모바일·게임>응용프로그래머>C#|인터넷·IT·통신·모바일·게임>응용프로그래머>Linux|인터넷·IT·통신·모바일·게임>응용프로그래머> Python
https://kr.indeed.com/viewjob?jk=90000209dcb25aaa,포스크리에이티브파티,VFX - COMPOSITE,서울 강남구,,합성 경험2.5D 세팅 / Deep 패스 합성능력카메라 / 색채학 / 빛에 대한 높은 이해도[우대 사항] Python 코딩능력프로젝트 Composite 리더경험 디자인>광고·CG·시각디자인>모션그래픽디자인|디자인>캐릭터·애니메...
https://kr.indeed.com/viewjob?jk=f065f7a2138205a5,Success Korea,플랫폼 서비스 개발 (및 유지보수),서울 강남구,,ㆍ 원활한 커뮤니케이션 능력 [필요기술/지식 등] ㆍ React 이용한 개발 경험 ㆍ JAVA 혹은 Python 기반 웹서버 개발 경험 ㆍ REST API 통한 서버와 Frontㆍend 데이터 연동 이해 ㆍ 다기기...
https://kr.indeed.com/viewjob?jk=649ccf047c868778,에스비씨엔,"금융 데이터 분석 엔진, 로보어드바이저 개발자",서울 영등포구,,"시스템, 머신러닝, 자연어처리. 패턴분석 - 다음 언어에서 최소 한 가지 이상 능숙자: Java, C++, Python, JavaScript 우대사항 - 석사이상 컴퓨터공학 (Computer Science) 분야 또는..."
https://kr.indeed.com/viewjob?jk=7a4a03e57d1263a2,이룸에스엔에스,기업부설연구소 연구원 경력 정규직,경기도 부천,,인터넷·IT·통신·모바일·게임>응용프로그래머>.NET|인터넷·IT·통신·모바일·게임>응용프로그래머>VB.NET|인터넷·IT·통신·모바일·게임>응용프로그래머>VoIP|인터넷·IT·통신·모바일·게임>응용프로그래머> Python
https://kr.indeed.com/viewjob?jk=73da420e5f99c59e,Prive Technologies,DevOps Engineer,서울,,"fundamentals, TCP/UDP, IP routing, VPN, HA & load balancing Python and bash scripting Monitoring tools: Prometheus, Grafana..."
https://kr.indeed.com/viewjob?jk=0052aae9f661290f,11번가,클라우드 엔지니어 모집,서울 남대문로5가,,"능력을 보유하신 분 -Cloud Migration 경험 및 AWS Certification 을 보유하신 분 - Python, Shell, Java 등의 언어를 사용하여 운영 관리 도구를 개발하고 운영하실 수 있으신 분 -ELK..."
https://kr.indeed.com/viewjob?jk=bf21320356840f15,펨트론,"기업부설연구소 (응용프로그래머, 영상처리, AI) 전문연구요원",서울 금천구,,응용프로그래머>VisualC|인터넷·IT·통신·모바일·게임>응용프로그래머>Visual C++(MFC·ATL)|인터넷·IT·통신·모바일·게임>웹프로그래머> Python|인터넷·IT·통신·모바일·게임>데이터베이스·DBA>MySQL
https://kr.indeed.com/viewjob?jk=83e1583e00db2175,Dunamu,DevOps Engineer,서울,,"험이 있으신 분 Terraform, Helm, Packer 등을 활용한 IaC 경험이 있으신 분 Java, Python, Golang 등 한 가지 이상의 개발 언어에 익숙하신 분 우대 사항 CNCF 생태계의 다양한 오픈소스를..."
https://kr.indeed.com/viewjob?jk=f8ee4cfdf4dd6934,웨이브릿지,성장하는 핀테크 스타트업 BackEnd Developer 경력직,서울 영등포구,,"적인 사고 및 알고리즘을 좋아하시는 분 Java, Spring 및 Design Pattern 에 대한 이해 Python 데이터 분석 및 웹개발 경험 RESTful API 서버에 대한 이해 및 구현 능력 기본적인 SQL문 작성..."
https://kr.indeed.com/viewjob?jk=c9c0370fa9baf512,대구경북과학기술원,DGIST-ETH 마이크로로봇연구센터 계약직 직원 공개 초빙 공고,대구 현풍면,,"다양한 응용을 위한 MEMS 기반 압전소자 특성 평가 MATLAB, Python 등의 프로그래밍을 사용한 실험 data 통계 분석 및 Image... 험자 우대 MATLAB, Python 등을 사용한 기본적인 프로 그래..."
https://kr.indeed.com/viewjob?jk=8cde6cc7c440976a,그림,(주)그림 소프트웨어(c++/MFC) 개발자,경기도 광명,"연봉 31,000,000원 - 50,000,000원","low level image processing)ㆍJava : UI program, python / C++ 검사프로그램과 통신ㆍ Python : Deep learning S/W 개발 [근무시간 및 형태] 주 5일 근무 (오전..."
https://kr.indeed.com/viewjob?jk=2442137ab45f071f,제우스로보틱스,지능형 서비스 로봇 개발 벤처기업 HW/SW/기구 개발 관련 개발자 ( 신입/경력 ),경기도 화성,,"학사이상 소지자, , C++/ Python등 프로그래밍 가능자, ROS2... 년)졸업 이상직무기술: 이학/공학 분야 학사이상 소지자, , C++/ Python등 프로그래밍 가능자, ROS2, Linux환경 개발 경험자, RL기반..."
https://kr.indeed.com/viewjob?jk=2c72782630a03bcb,신한금융투자,파생운용1부 경력직 채용,서울 여의도,,"채용에 결격 사유가 없는 자 남성의 경우 군필 또는 면제자 해외여행에 결격 사유가 없는 자 우대사항 Python, Rust, Javascript, C++ 등의 한가지 이상 언어에 능숙하신 분 풀스택 웹 서비스 개발..."
https://kr.indeed.com/viewjob?jk=e2b0f9d5efdb5b29,한국일보사,IT팀 개발자 경력 사원 공개 채용,서울 남대문로5가,,"자격사항 - 관련 경력 5년 이상 - 백 엔드 개발 경험 - Java, Python 등 클라우드 환경 내 개발 경험 • 우대사항 - Java, Python 등 쿨라우드 환경 내 개발 경험 우대 정규직 0명 * 근무지..."
https://kr.indeed.com/viewjob?jk=98aee508bc33239c,(주)RGA Inc.,인공지능(AI) 기술 개발(경력 3년 이상),서울 강남역,"연봉 150,000,000원 - 350,000,000원","요건(필요경력)]* ㆍ컴퓨터 공학 분야 대졸이상 (졸업예정자 가능) ㆍ컴퓨터 비전, 강화학습 개발 경험 ㆍ Python, C++개발 경험 ㆍPyTorch, Tensorflow 등의 머신러닝 툴 경험자 *[우대사항]* ㆍ*코딩..."
https://kr.indeed.com/viewjob?jk=f3814da45c7f7954,프루팅,웹 프론트엔드 개발자,서울 서초구,,"ㆍ학력 : 무관 ㆍ나이/성별 : 무관 담당업무 ㆍ웹 프론트엔드 개발, 필수조건:(language: python, nodejs framework: react, django/flask), 우대 조건:(database..."
https://kr.indeed.com/viewjob?jk=f9eeef2ae18870e6,대구경북과학기술원,DGIST-ETH 마이크로로봇연구센터 계약직 연구원 공개 초빙 공고,대구 현풍면,,"Fluorescence imaging 경험자 우대 MATLAB, Python 등을 사용한 기본적인 프로그래밍 경 험자 우대 급여수준 : 관련... 우대 사항 MATLAB, Python 등을 사용한 기본적인 프로그래밍..."
https://kr.indeed.com/viewjob?jk=3f89a7e712319583,현대자동차그룹,[선행기술원] 차량용 반도체_HW 개발 (NPU)[책임연구원],성남 판교역,,"수행 경험을 보유하신 분 Verilog, SPICE, VBA 및 프로그래밍 언어 (C, C++, System C, Python 등) 활용 능력을 보유하신 분 ICT, SW, 플랫폼 등 미래 기술 분야에서 Engineering..."
https://kr.indeed.com/viewjob?jk=c7c3b8821c6d6949,한국사이버결제,"IT시스템 운영부문 (서버,DBMS,백업,DB접근제어) 신입사..",서울 구로구,,"OS,DBMS,WAS) + 프로그래밍적인 지식(Shell,C,Java,javas9;r-5;pt,HTML,CSS, Python,SQL... 을 학습해 나가는 것을 좋아하고, 그럴 역량이 있으신 분 (3) 위 (2)번의..."
https://kr.indeed.com/viewjob?jk=34923cf219b723b9,TraceTronic GmbH,Test Validation Engineer (m/w/d),대한민국,,"programming in C, C++, Java or scripting languages ( Python, PHP, Perl, etc.) is beneficial Familiarity with automotive bus..."
https://kr.indeed.com/viewjob?jk=f59a6ef8bfb978f8,기업명,반도체 팹리스기업 SW HW 회로설계 등 엔지니어 채용,서울 서초구,,"H/W 설계 엔지니어 2. 채용조건 : 신입/경력 3. 필수사항 : 학사 이상, ‘C/C++, C#, Python’ 중 한 개 이상 언어 사용기술 보유자, ‘OrCAD, Pads’ 등 H/W 설계 관련 Tool 사용기술..."
https://kr.indeed.com/viewjob?jk=88b7dece067cd1c6,펄핏,AI Algorithm Developer,서울 강남구,,"원합니다. - 자격요건, 어떤 조건이 필요한가요? 컴퓨터 공학 분야 MS 또는 PhD 학위 소지 C/C++/ python, software design, AI algorithms 에 대한 전문적인 지식 소지 원활한 의사소통..."
https://kr.indeed.com/viewjob?jk=88656c28e936d971,KPMG-Korea,"[Audit] IA본부 내부감사, 내부통제 진단 및 개선, SOC 1 인증업무, 컴플라이언스 분야 채용",대한민국,,"플라이언스 체계 구축자문 경험자 - ERP 운영/개발 유경험자(SAP FI, MM, SD 등) - SQL, Python 등을 활용한 Big Data 분석 경험자- 회계법인 및 내부감사 부서 근무경력 우대 - SOC 1 인증보..."
https://kr.indeed.com/viewjob?jk=2b9671772c132efa,LVIS,"Machine Learning Engineer(머신런닝 엔지니어, 서울)",서울,,및 관련 분야에서 석사 학위 혹은 3년 이상 아카데믹/산업계 수준에서의 딥러닝 프로젝트 경험이 있으신 분 Python에 대한 능숙한 프로그래밍 스킬 컴퓨터 비전/ML 관련 최신 논문을 읽고 구현 또는 적용이 가능하신 분 뇌공...
https://kr.indeed.com/viewjob?jk=f50e4f2129199331,Cisco Systems,CX Consulting Engineer (Technical Leader),서울,,"tasks. Good to have: Knowledge on Cisco products Python, Ansible, and related automation toolset practical experience..."
https://kr.indeed.com/viewjob?jk=076ece940fe490f8,메가존클라우드,[메가존클라우드] Back-end Developer,서울 강남구,,로덕트 개발 인터넷·IT·통신·모바일·게임>응용프로그래머>JAVA|인터넷·IT·통신·모바일·게임>응용프로그래머> Python|인터넷·IT·통신·모바일·게임>게임(Game)>서버·네트워크개발|인터넷·IT·통신·모바일·게임>전산...
https://kr.indeed.com/viewjob?jk=4f2c497de5a7c4ca,EY,[EY컨설팅] 금융컨설팅본부 리스크관리 경력 컨설턴트 모집,서울 영등포구,,"국내외 금융기관 리스크관리 컨설팅 또는 여신업무 프로세스 개선(PI) 컨설팅 경험 - SAS, SQL, Python, R 등을 활용한 데이터분석 역량 보유자 우대 - 관련 자격증 소지자 (FRM 등) 우대 - 외국어..."
https://kr.indeed.com/viewjob?jk=a29697c08fc49a56,주식회사 유락,함께 성장할 S/W개발자 모집합니다.,전라북도 완주,"연봉 24,000,000원 - 26,000,000원","조건 : 주 5일(40시간)근무 지원자격 : 프로그램 코딩 가능자 프로그램 언어 무관( C, C++, Python, Java 등) 담당업무 : S/W개발 담 당 자 : 김용진 010-7446-1120 yongjinin..."
https://kr.indeed.com/viewjob?jk=4acb331033a1064f,Amazon Web Services Korea LLC,"Cloud Support Engineer, Big Data",서울,,Intermediate programming/scripting skills. Ideally in Java or Python... consider experience in other Object Oriented...
https://kr.indeed.com/viewjob?jk=68f6927e75c69366,현대자동차그룹,Robotics Engineer [Dialogue System][연구원],대한민국,,"학위 보유자 전자공학/ 컴퓨터공학 전공자 챗봇, NLU, DM 알고리즘 및 시스템 개발 경험자 C/C++, python 등 프로그래밍 능력 보유자 우대사항 SW 개발 관련 자격증, 알고리즘 경진대회 수상자 SW API/SDK..."
https://kr.indeed.com/viewjob?jk=12184c9f924106e6,엘리스,백엔드 개발자,서울 강남구,,"요원 가능 【주요 업무】 • Python 기반 백엔드 프로젝트 신규 기능... 온라인 교육 소프트웨어 운영/개발 경험 【기술 스택】 • Python 3.7+ • Python 기반 웹 프레임워크 (aiohttp, django..."
https://kr.indeed.com/viewjob?jk=7e67c40386afbf1d,KIS채권평가,각 부문별 신입/경력 채용 공고[파생평가사업본부],서울 여의도,,"보유자 2. 책임감 있고 꼼꼼하며 업무 등에 적합한 긍정적 성격 3. 프로그래밍(MS Office, VBA, Python 등)경험자 우대 4. 관련업무 경력자 우대 전형절차 및 일정 서류접수 3/8 (수) ~ 3/19..."
https://kr.indeed.com/viewjob?jk=9fa1f6a30dbe6923,비상교육,23년 3월 비상교육 IT직무 수시채용(경력),대한민국,,"이터 분석 및 시각화. BI 리포트 개발 1. 필요역량 - SQL, Python 등을 활용을 통한 데이터 가공/분석 능력, 대용량 데이터 분석... 1. 필요역량 - SQL, Python 등을 활용을 통한 데이터 가공..."
https://kr.indeed.com/viewjob?jk=227dcf80f6f726fc,에이치앤비지노믹스 관심기업,데이터 마케터 모집,울산 언양읍,,"자격요건 인원 데이터분석툴 ( Python/R)을 활용한 시황/시﻿장정보... 경력 : 신입무관 / 성별 : 무관 / 연령 : 무관 데이터분석툴 ( Python/R)을 활용한 마케팅 성과지표 관리기술, 마케팅 전략수립기술, 보고..."
https://kr.indeed.com/viewjob?jk=2d9f95753374be0e,카카오뱅크,데이터 웨어하우스 운영자 (대규모 채용),성남 백현동,,"유한 분 · BI 서비스, 지표 제공 및 대내외 보고서 개발/운영 경험을 보유한 분 · 숙련된 SQL 능력과 Python 데이터 처리 경험을 보유한 분 우대사항 · 데이터웨어하우스 개발/운영 경험을 보유한 분 · 클라우드..."
https://kr.indeed.com/viewjob?jk=6b8a44fa714646f6,쿠노소프트,펌웨어(임베디드) SW 개발자(경력자) 초빙,서울 성북구,,"두이노를 사용한 IOT 센싱 기술 개발 (WIFI, Bluetooth, 온도, 습도 등)- C/C++ 혹은 Python 개발 가능하신 분- 기본적인 회로도를 이해 하실 수 있는 분- 라즈베리 파이의 경우 Linux 기반 개발..."
