ID,CompanyName,Title,CompanyLocation,Salary,Summary
https://kr.indeed.com/viewjob?jk=1015284880e2ff62,IPX,라인프렌즈[IPX] 2022년 각 부문 수시,서울 용산구,,웹프로그래머>프론트엔드|인터넷·IT·통신·모바일·게임>웹프로그래머> Python|인터넷·IT·통신·모바일·게임>응용프로그래머>JAVA|인터넷·IT·통신... 통신·모바일·게임>응용프로그래머> Python|인터넷·IT·통신·모바일·게임...
https://kr.indeed.com/viewjob?jk=88960e11c2cdd682,블록스퀘어서울,데이터분석 신입/경력 정규직,서울 서초구,,"및 지식 보유자 * SQL, Python, R 등 분석 관련 언어 활용... 엑셀 가능자- 각종 통계 모델 활용 경험 및 지식 보유자- SQL, Python, R 등 분석 관련 언어 활용 가능자- 논리적인 분석 결과보고서 작성..."
https://kr.indeed.com/viewjob?jk=4c25d6649f8434a8,유한회사 미소,[외국계 스타트업 미소] Business Analyst Intern (정규직 전환형),서울,,통신·모바일·게임>빅데이터·AI(인공지능)>데이터분석|인터넷·IT·통신·모바일·게임>빅데이터·AI(인공지능)> Python|인터넷·IT·통신·모바일·게임>데이터베이스·DBA>MySQL|인터넷·IT·통신·모바일·게임>데이터베이스...
https://kr.indeed.com/viewjob?jk=5eda03fdcd12e221,벽산,2023년 신입/경력사원 수시,서울 중구,,"Java, JavaScript, Python 등) 데이터베이스 언어 최소... 응용프로그래머>자바스크립트|인터넷·IT·통신·모바일·게임>응용프로그래머> Python|인터넷·IT·통신·모바일·게임>응용프로그래머>VB.NET|인터넷..."
https://kr.indeed.com/viewjob?jk=8b82670b52cf5e98,카카오페이,비즈니스 데이터 분석가 (Business Data Analyst) 영입,성남 분당구,,페이 서비스 자세히 보기- 카카오페이 크루가 일하는 방법 자세히 보기- 카카오페이 문화에 대해 더 알아보기 조 인터넷·IT·통신·모바일·게임>데이터베이스·DBA>SQL|인터넷·IT·통신·모바일·게임>응용프로그래머> Python
https://kr.indeed.com/viewjob?jk=a31927b61381ec99,신세계야구단,SSG랜더스 2023년 마케팅팀 신규,인천,,"업무 경험, 2.App서비스 기획 및 운영 경력 보유자, 3.데이터 분석 경력 보유자 또는 SQL, R, Python 중 1개 Language 이상 사용 가능한 자 마케팅·광고·홍보·조사>마케팅>CRM|인터넷·IT·통신·모바..."
https://kr.indeed.com/viewjob?jk=1601f1bfe3302af5,반달소프트,2023년 상반기 백엔드 개발자,성남 분당구,,"수상자 우대- JS, PHP, Python 등 Back End 관련 프로젝... 관련 전공자 및 경력자- IT관련 경진대회 수상자- JS, PHP, Python 등 Back End 관련 프로젝트 경험자 인터넷·IT·통신·모바일..."
https://kr.indeed.com/viewjob?jk=e32bdbdd2af9af86,네이버제트,[NAVER Z] 데이터 엔지니어,성남 분당구,,"역량 - 관련 분야 개발 경력 3년 이상이신 분- Scala/Java/ Python, Spark, Kafka(Stream) 기반 빅 데이터 처리 경험이... 통신·모바일·게임>응용프로그래머> Python|인터넷·IT·통신·모바일·게임..."
https://kr.indeed.com/viewjob?jk=3cbd2f42de625fab,피플펀드컴퍼니,[병역 특례 가능] 백엔드 엔지니어(Python),서울 서초구,,"백엔드 엔지니어( Python)는, 주요 업무 최고의 금융 경험을 제공하기 위한 제품 사용 여정을 개발하고 개선합니다. 인터넷·IT·통신·모바일·게임>웹프로그래머>백엔드"
https://kr.indeed.com/viewjob?jk=5ccb95e3fe5f6994,페이히어,서버 엔지니어 (Python),서울 강남구,,회사 소개 페이히어는 매장의 새로운 미래를 만들고 있습니다. 인터넷·IT·통신·모바일·게임>웹프로그래머> Python|인터넷·IT·통신·모바일·게임>응용프로그래머> Python
https://kr.indeed.com/viewjob?jk=d158e683dc0b7500,데이터앤솔루션,파이썬 개발자 초중급 이상,서울 서초구,,접전형 접수방법 채용시 접수방법: 인크루트 채용시스템접수양식: 인크루트 이력서 기타 유의사항 입사지원서 및 제출서류에 허위사실이 있을 경우 채용이 취소될 수 있습니다. 인터넷·IT·통신·모바일·게임>응용프로그래머> Python
https://kr.indeed.com/viewjob?jk=2e45e43017a6ea1f,GS칼텍스,2023년 DIgital Lab 전문계약직 상시,서울 강남구,,응용프로그래머>클라우드|인터넷·IT·통신·모바일·게임>응용프로그래머> Python|인터넷·IT·통신·모바일·게임>ERP·시스템분석·설계>딥러닝|인터넷... 게임>빅데이터·AI(인공지능)> Python|인터넷·IT·통신·모바일·게임...
https://kr.indeed.com/viewjob?jk=87309d3ff40ead61,베이리스,딥러닝 AI 개발 연구원,성남 수정구,,시스템프로그래머>임베디드(Embedded)|인터넷·IT·통신·모바일·게임>응용프로그래머>C·C++|인터넷·IT·통신·모바일·게임>응용프로그래머>Linux|인터넷·IT·통신·모바일·게임>빅데이터·AI(인공지능)> Python
https://kr.indeed.com/viewjob?jk=e3f3b7e2103d9bc7,코인챗,"웹개발, 백엔드 외 신입/경력 정규직",서울 강남구,"연봉 40,000,000원 - 50,000,000원",로그래머>웹개발|인터넷·IT·통신·모바일·게임>웹프로그래머>백엔드|인터넷·IT·통신·모바일·게임>웹프로그래머>프론트엔드|인터넷·IT·통신·모바일·게임>웹프로그래머> Python|인터넷·IT·통신·모바일·게임>웹프로그래머>PHP
https://kr.indeed.com/viewjob?jk=0eff71fabf6c4b1f,재단법인 한국에이아이블록체인융합원,인공지능 기초부터 프로젝트 실습까지:Python과 Weka활용(취업연계),경상남도,,서브텍스트) 회사소개 과정개요 인공지능의 기본 개념과 알고리즘 학습 Python과 Weka를 활용하여 인공지능 기반의 프로젝트 실습 교육대상 인공지능... 게임>빅데이터·AI(인공지능)> Python|인터넷·IT·통신·모바일·게임...
https://kr.indeed.com/viewjob?jk=3058f7280a2e6644,데브시스터즈,[데브시스터즈] DevOps Engineer (신입),서울 강남구,,인터넷·IT·통신·모바일·게임>네트워크·서버·보안>UNIX·LINUX계열 서버운영·관리|인터넷·IT·통신·모바일·게임>네트워크·서버·보안>기타 서버운영·관리|인터넷·IT·통신·모바일·게임>웹프로그래머> Python
https://kr.indeed.com/viewjob?jk=ed7b7e6eb72ffab8,Google,"2023 Software Engineering Intern, People with Disabilities (장애인 채용)",서울,,"purpose programming languages (e.g., Java, C/C++, C#, Objective-C, Python, JavaScript, Go, etc.). About the job Join us..."
https://kr.indeed.com/viewjob?jk=08546574c6378e02,시니어앤파트너즈,"[선릉역] 서버개발,백엔드(앱,웹,AWS,Python)",서울 강남구,,"폴리오) 사진부착, 이직사유, 최종연봉, 희망연봉, 출근가능일 기재 [선릉역] 서버개발,백엔드(앱,웹,AWS, Python) 회사개요채용사는 2013년 6월에 카이스트 연구실 창업을 통해 설립된 스타트업으로, NIRS(Near..."
https://kr.indeed.com/viewjob?jk=329e2b0216072240,크라우드웍스,[크라우드웍스] NLP 엔지니어,서울 강남구,,튜닝- 최신연구결과 (SOTA) 지속 검토 및 활용2. 이런 경험과 역량을 가진 분을 찾고 있습니다!- Python/huggingface 기반 개발이 가능하신 분- 자연어처리 모델 모니터링 및 튜닝이 가능하신 분 - Git...
https://kr.indeed.com/viewjob?jk=1ddabedf5262b80f,현대건설,2023년 현대건설 R&D 분야 전문인력 선발,서울 종로구,,"관련 경력자 로봇 관련 기술개발 프로젝트 수행 유경험자 우대사항 로봇 운영 환경(ROS, Linux, Python, C++ 등) 숙련자 건설로보틱스, 3D프린팅 등 건설 자동화 프로젝트 유경험자 빅데이터/AI 건설..."
https://kr.indeed.com/viewjob?jk=1eeb4f006adf13ba,블록스퀘어서울,"웹개발자 백엔드&서버개발(HTML·DHTML·mHTML, JAVA 외) 신입/경력 정규직",서울 서초구,,통신·모바일·게임>웹프로그래머>HTML·DHTML·mHTML|인터넷·IT·통신·모바일·게임>웹프로그래머>JAVA|인터넷·IT·통신·모바일·게임>웹프로그래머>백엔드|인터넷·IT·통신·모바일·게임>웹프로그래머> Python
https://kr.indeed.com/viewjob?jk=20d792ea3f7471fa,두나무,Python Backend Engineer,서울 강남구,,"드와 백오피스 시스템 개발다양한 외부 플랫폼에 대한 연동 시스템 개발자격 요건Django, Flask 등 Python 기반 WebFramework 를 활용한 백엔드 개발 경험이 3년 이상 있으신 분RDBMS 에 대한 경험 및..."
https://kr.indeed.com/viewjob?jk=0d1d92bda9e4fd11,십일번가,[11번가] 클라우드 엔지니어,서울 중구,,[11번가] 클라우드 엔지니어 모집 인터넷·IT·통신·모바일·게임>ERP·시스템분석·설계>AWS|인터넷·IT·통신·모바일·게임>응용프로그래머> Python
https://kr.indeed.com/viewjob?jk=b7223c792bfcbcd4,액스,백엔드 개발자(인턴십),서울 서초구,,주식회사 액스백엔드 개발자(인턴십) 기업소개 인터넷·IT·통신·모바일·게임>웹프로그래머>백엔드|인터넷·IT·통신·모바일·게임>응용프로그래머> Python|인터넷·IT·통신·모바일·게임>ERP·시스템분석·설계>AWS
https://kr.indeed.com/viewjob?jk=fd6490c902a88c72,비트리스,"데이터분석, 데이터사이언스 신입/경력",서울 서초구,"연봉 35,000,000원 - 45,000,000원","AI/ML - 데이터 시각화 (R, Tableau, Biorender) - 프로그래밍 언어 (R, Python, Matlab, Java) - 유닉스/리눅스 환경 - SQL, Hadoop - Markup languages..."
https://kr.indeed.com/viewjob?jk=5bb88b636c0aeea6,에스케이스페셜티,DT그룹 인턴사원,서울,,DT그룹 인턴사원 모집 인터넷·IT·통신·모바일·게임>웹프로그래머> Python|인터넷·IT·통신·모바일·게임>응용프로그래머> Python|인터넷·IT·통신·모바일·게임>빅데이터·AI(인공지능)> Python
https://kr.indeed.com/viewjob?jk=986af445137757d7,시니어앤파트너즈,"[선릉역] 데이터.신호처리(석박사급,Matlab,Python)",서울 강남구,,"성별무관- 경력 : 경력 1년~5년 (신입지원 가능)- MatLab/ Python을 이용한 시계열 데이터 분석 경험 (생체신호 우대)- 데이터 구조 및... 신호처리(석박사급,Matlab, Python) 회사개요채용사는 카이스트 연구..."
https://kr.indeed.com/viewjob?jk=5939f1161708ca93,사이냅소프트,2023년 상시 [신입/경력] 개발자 중,서울 강서구,,래머>JAVA|인터넷·IT·통신·모바일·게임>웹프로그래머>웹개발|인터넷·IT·통신·모바일·게임>웹프로그래머> Python|인터넷·IT·통신·모바일·게임>응용프로그래머>JAVA|인터넷·IT·통신·모바일·게임>응용프로그래머>자바스...
https://kr.indeed.com/viewjob?jk=9bfff5e8649d2814,Mercedes-Benz Korea Limited,"SW Developer for MBUX Korean Voice Assistant (Python, Java)",서울,,talented Python/JAVA developer... Platform) which requires knowledge of Python - Manage NLU model through reviewing...
https://kr.indeed.com/viewjob?jk=dc4b5e342e7ae6a0,시스메틱,백엔드 엔지니어 (Python/Javascript),서울 영등포구,,우리 회사를 한 줄로 표현해주세요 (주)시스메틱 백엔드 엔지니어 모집( Python/Javascript) 우리 회사에 대해 4줄 이내로 소개해주세요... 통신·모바일·게임>응용프로그래머> Python|인터넷·IT·통신·모바일·게임...
https://kr.indeed.com/viewjob?jk=9614834fe0f9c8e3,두나무,데이터 사이언티스트,서울 강남구,,게임>빅데이터·AI(인공지능)>빅데이터|인터넷·IT·통신·모바일·게임>데이터베이스·DBA>데이터사이언스|인터넷·IT·통신·모바일·게임>데이터베이스·DBA>MySQL|인터넷·IT·통신·모바일·게임>응용프로그래머> Python
https://kr.indeed.com/viewjob?jk=b047d88258576e1c,신세계아이앤씨,AI 백엔드 개발부문 인재,서울 중구,,등)- 고객경험(Customer Experience) 솔루션 딜리버리[지원자격: 3년 이상 경력자] - Java 혹은 Python 개발언어 숙련도가 높으신 분- RDBMS SQL 지식 및 개발 경험 보유하신 분- Docker...
https://kr.indeed.com/viewjob?jk=a6c15fbd57a9747d,앤씨앤,딥러닝 영상 인식 Researcher,성남 분당구,,"자격요건ㆍ학력/전공 : 학사 이상ㆍ경력 : 무관ㆍ프로그래밍 언어 : Python, C/C++ㆍ(신입) 배우고자 하는 의지가 강한 사람근무지역(주)앤씨... 통신·모바일·게임>응용프로그래머> Python|인터넷·IT·통신·모바일·게임..."
https://kr.indeed.com/viewjob?jk=441c717c2b82b684,두나무,디지털 자산 리서치 인턴,서울 강남구,,Full-time 근무 가능하신 분 (재학생/휴학생/졸업생)우대 사항영어 및 기타 외국어에 능통하신 분데이터 관리 툴 사용 경험이 있으신 분 ( Python 등) 마케팅·광고·홍보·조사>조사·분석·통계>설문·리서치·모니터링
https://kr.indeed.com/viewjob?jk=740e46553d6c435b,한국ESG기준원,IT 전문인력 공개,서울 영등포구,,"문인력 학사 학위이상 소지자로서, DBA 경력이 3년 이상인 자 데이터 분석 플랫폼 구축/운영 경력 보유자 Python, R, SQL 등 데이터분석 툴 활용 가능자 우리원 채용결격사유*에 해당되지 않는 자 해외여행 결격사유가..."
https://kr.indeed.com/viewjob?jk=5019d9a10d6c9b45,한국행동과학연구소,한국행동과학연구소 전산직,서울 강남구,,"이너-벡엔드개발자 [자격요건]- 컴퓨터공학전공 또는 HTML5, CSS3 등 관련 교육 이수자- java, python, php, nodejs 중 1개 이상 사용가능자- mysql, Linux, docker 경험자 우대[담당..."
https://kr.indeed.com/viewjob?jk=83f4939522ffaa68,인텔코리아,JR0192526 SW engineer intern,서울,,"SW Programming 실력(C/C++/ Python/ShellScript, …)[우대사항]- 문서 작성 및 영어 작문/회화 능력- SW Programming(C/C++/ Python/Shell Script) 언어에 능숙..."
https://kr.indeed.com/viewjob?jk=3544467a7b64376f,메디픽셀,[전문연구요원] 의료영상 리서치 엔지니어 정규직,서울 마포구,,"학력무관직무기술: VISUALC++, 응용프로그래밍, C·C++, Python, AI개발 2 명 근무조건 고용형태: 정규직(수습기간3개월)근무부서... 머신러닝(ML)|인터넷·IT·통신·모바일·게임>응용프로그래머> Python"
https://kr.indeed.com/viewjob?jk=a30e8ebba95e35fd,에스엠소프트,책임/수석급 SW개발자 공개,전라남도 나주,"연봉 60,000,000원 - 70,000,000원",백엔드|인터넷·IT·통신·모바일·게임>웹프로그래머>프론트엔드|인터넷·IT·통신·모바일·게임>웹프로그래머> Python|인터넷·IT·통신·모바일·게임>응용프로그래머>C·C++|인터넷·IT·통신·모바일·게임>응용프로그래머>C#...
https://kr.indeed.com/viewjob?jk=ec5c7ccd76639120,유한회사 미소,[외국계 스타트업 미소] Data Analyst,서울,,통신·모바일·게임>빅데이터·AI(인공지능)>데이터분석|인터넷·IT·통신·모바일·게임>빅데이터·AI(인공지능)> Python|인터넷·IT·통신·모바일·게임>데이터베이스·DBA>MySQL|인터넷·IT·통신·모바일·게임>데이터베이스...
https://kr.indeed.com/viewjob?jk=97442d3064240494,SAP,Vocational Training Program Intern (Engine) - 2024/2025 Graduates Korea (VT/STAR),서울,,"one or more programming languages (e.g. Go, C, C++, Python, JavaScript, Typescript, SQL etc.) Intermediate communication..."
https://kr.indeed.com/viewjob?jk=3ccbc30d82ce5848,크래프톤,[Engineering Div.] Data Analyst (경력 무관),서울 강남구,,인터넷·IT·통신·모바일·게임>웹프로그래머> Python|인터넷·IT·통신·모바일·게임>응용프로그래머> Python|인터넷·IT·통신·모바일·게임>빅데이터·AI(인공지능)> Python|인터넷·IT·통신·모바일·게임>데이터베이스...
https://kr.indeed.com/viewjob?jk=71c47ac87bb4087e,써로마인드로보틱스,기술 인턴 인공지능 응용 연구/개발 인턴,서울 관악구,,"6개월) (협의) *모집 절차: 서류 à인터뷰(오프라인) *지원 자격: 프로그래밍 언어 활용 능력: Python, C, C++ 중 1가지 이상 데이터구조, 알고리즘 과목 이수 머신러닝과 딥러닝의 기본 개념 이해 머신러닝..."
https://kr.indeed.com/viewjob?jk=da692935f8531ad0,Nexon,[인텔리전스랩스] 데이터 분석가 (마케팅컨텐츠개발),경기도 성남,,및 ETL까지의 전반적인 프로세스 관리 - 게임 트렌드 관련 인사이트 분석 보고서 작성 지원자격 - Python을 활용한 데이터 분석 경험 - SQL(MySQL/MSSQL 등)을 사용하여 효율적으로 데이터 추출이 가능...
https://kr.indeed.com/viewjob?jk=540a0b30ee91ba4e,대한상공회의소,대한상공회의소 IT분야 교사,서울 중구,"연봉 50,000,000원 - 60,000,000원",통신·모바일·게임>빅데이터·AI(인공지능)>빅데이터|인터넷·IT·통신·모바일·게임>빅데이터·AI(인공지능)> Python|인터넷·IT·통신·모바일·게임>빅데이터·AI(인공지능)>머신러닝|인터넷·IT·통신·모바일·게임>빅데이터...
https://kr.indeed.com/viewjob?jk=39d19b49e76b203d,한국전파진흥협회,2023년 메타버스 아카데미 2기 교육생,성남 분당구,,통신·모바일·게임>응용프로그래머> Python|인터넷·IT·통신·모바일·게임... 통신·모바일·게임>웹프로그래머> Python|인터넷·IT·통신·모바일·게임>빅데이터·AI(인공지능)> Python|인터넷·IT·통신·모바일·게임>빅데이터...
https://kr.indeed.com/viewjob?jk=4cc15c26097421c5,바인테크,개발자 - Python 서버 프로그램 개발,서울 송파구,,"(주)바인테크 Python 개발자 모집부문 및 자격요건 담당업무 자격요건 인원 [담당업무]개발자 - Python 프로그래밍레거시 프로그램의 Java... 팀원, 대리, 차장 [필요기술]ㆍ Python 프로그래밍 필수ㆍJava, C..."
https://kr.indeed.com/viewjob?jk=c0e7d5f654cb8dfb,라이트비전,컴퓨터비전 개발자 경력 정규직,서울 성동구,,"가능한 사람A-3) C/C++, Python 언어에 능숙한 사람[우대 사항... 공지능(AI)|인터넷·IT·통신·모바일·게임>빅데이터·AI(인공지능)> Python|인터넷·IT·통신·모바일·게임>소프트웨어·하드웨어>소프트웨어|인터넷..."
https://kr.indeed.com/viewjob?jk=7ad0475e5038f982,구름,[신입/경력] 인프라 엔지니어,성남 분당구,,"경우) 병역의 의무를 마친 분 또는 군면제자 이런 분이면 더 좋아요 신입/경력 모두 지원 가능 golang, python에 능숙하신 분 리눅스 환경에 익숙하신 분 네트워크, 스토리지 관련 지식 있으신 분 Docker, K8S..."
https://kr.indeed.com/viewjob?jk=fc4ce8e7031b4ab0,경연파트너스,대기업계열 모빌리티 데이터 분석 모델 개발 (신입/경력),서울 용산구,,"전처리 [자격 요건] - C/C++, Python 개발 경력 - 공간 정보에 대한 이해 보유 [기술 스택] - OS: Windows, Linux - 개발언어: C/C++, SQL, Python - Tool: Visual..."
https://kr.indeed.com/viewjob?jk=3be7ae7d903b8f1e,에스케이온,Battery DT혁신 경력,서울 종로구,,자동화 수행 경험우대사항통계 지식 보유 및 분석 도구 활용(Spotfire/matlab/minitab/R/ Python) 경험BI 도구 (Tableau 등 분석용 툴) 숙련자정형/비정형 및 연계 데이터 분석 기획 경험데이터...
https://kr.indeed.com/viewjob?jk=d83fc0dd2641f483,딥엑스,전문연구요원 (병역특례) 수시 (AI / SW 분야),성남 분당구,"연봉 40,000,000원 - 100,000,000원",통신·모바일·게임>응용프로그래머>인공지능(AI)|인터넷·IT·통신·모바일·게임>응용프로그래머>머신러닝(ML)|인터넷·IT·통신·모바일·게임>응용프로그래머> Python|인터넷·IT·통신·모바일·게임>응용프로그래머>C·C++
https://kr.indeed.com/viewjob?jk=d2e4b66aaa70d0aa,아우토크립트,C++/Python 개발자 (병역특례 가능),서울 영등포구,,C++/ Python 개발자 채용 (병역특례 가능) 인터넷·IT·통신·모바일·게임>응용프로그래머>C·C++|인터넷·IT·통신·모바일·게임>응용프로그래머> Python
https://kr.indeed.com/viewjob?jk=51df90967b46e8f0,유한회사 미소,[외국계 스타트업 미소] Business Analyst,서울,,통신·모바일·게임>빅데이터·AI(인공지능)>데이터분석|인터넷·IT·통신·모바일·게임>빅데이터·AI(인공지능)> Python|인터넷·IT·통신·모바일·게임>데이터베이스·DBA>MySQL|인터넷·IT·통신·모바일·게임>데이터베이스...
https://kr.indeed.com/viewjob?jk=b52d7d04fd1aa41f,라이트비전,AI 연구개발자 전문연구요원(병역특례),서울 성동구,,이상A-2) C/C++ 혹은 Python 언어에 능숙한 사람[우대사항]B... 공지능(AI)|인터넷·IT·통신·모바일·게임>빅데이터·AI(인공지능)> Python|인터넷·IT·통신·모바일·게임>소프트웨어·하드웨어>소프트웨어|인터넷...
https://kr.indeed.com/viewjob?jk=2b7db4b61729c1b5,당근마켓,데이터 엔지니어 - 당근페이,서울 서초구,,있으신 분클라우드 환경에서의 데이터 플랫폼 구축 및 운영이 가능하신 분하나 이상의 백엔드 프로그래밍 언어( Python / Scala / Java / Go 등)에 능숙하신 분Airflow 등을 활용한 워크플로우 관리 경험이...
https://kr.indeed.com/viewjob?jk=95248cc2bf2a7dff,현대오토에버,레드팀 스페셜리스트 경력,서울 강남구,,"시나리오 기반 모의해킹 , APT 공격, Black box Test 경력 - 개발 언어 사용 가능 ( Python, C, C++, Java 등) 2) 우대 - RED Team 업무 수행 경력 - Defcon 입상, 해킹대회..."
https://kr.indeed.com/viewjob?jk=25b3c3e6a66bd77c,KB데이타시스템,그룹공동 마이데이터 분석 플랫폼(데이터분석가),서울 마포구,,인터넷·IT·통신·모바일·게임>통신·모바일>플랫폼(VM)|인터넷·IT·통신·모바일·게임>응용프로그래머> Python|인터넷·IT·통신·모바일·게임>응용프로그래머>머신러닝(ML)|인터넷·IT·통신·모바일·게임>빅데이터·AI(인공...
https://kr.indeed.com/viewjob?jk=6b53335986238646,데브시스터즈,[데브시스터즈] Data Analyst,서울 강남구,,img { width: 100%; } 인터넷·IT·통신·모바일·게임>데이터베이스·DBA>SQL|인터넷·IT·통신·모바일·게임>응용프로그래머> Python|인터넷·IT·통신·모바일·게임>전산·IT기술지원>IT기술지원
https://kr.indeed.com/viewjob?jk=cf99a4662ad1c936,현대자동차그룹,[ICT] Data Scientist - 자연어처리[매니저],대한민국,,"Tensorflow)를 사용한 의미 있는 프로젝트 개발 경험을 보유하신 분 데이터 사이언스를 위한 언어(예, Python) 를 하나 이상 능숙하게 다룰 수 있으신 분 TensorFlow/Keras, PyTorch..."
https://kr.indeed.com/viewjob?jk=f1a40936df480707,하람아이,2023년 (주)하람아이 AI팀,성남 수정구,,인터넷·IT·통신·모바일·게임>빅데이터·AI(인공지능)> Python|인터넷·IT·통신·모바일·게임>빅데이터·AI(인공지능)>딥러닝|인터넷·IT·통신·모바일·게임>빅데이터·AI(인공지능)>머신러닝
https://kr.indeed.com/viewjob?jk=ba273637cd66bf39,GE Appliances,GEDP,경기도 성남,,using C programming language Scripting languages like Lua/ Python/JavaScript may also be used if needed Support connected...
https://kr.indeed.com/viewjob?jk=dff009ea82cabff6,반프,상반기 R&D 대규모 (데이터 비주얼라이징 개발),서울 강남구,,"수 있도록 이해 시키고 적합한 방향으로 이끌 수 있는 분[우대경험]- 데이터 분석/시각화 솔루션 (기타 Python, Shell script 등) 경험 우대[제출서류]- 경력기반 이력서- 직무기반 포트폴리오 00 명 근무조건..."
https://kr.indeed.com/viewjob?jk=3d0e22b9756facb8,MOLOCO,Data Analyst Intern - Korea,서울,,regression or time-series analysis. Programming: experience in Python and SQL is required. Comfortable balancing multiple...
https://kr.indeed.com/viewjob?jk=da437cb9cae31254,루벤티스,"데이터마이닝, 인공지능(AI) 외 경력",서울 강남구,,통신·모바일·게임>데이터베이스·DBA>데이터마이닝|인터넷·IT·통신·모바일·게임>응용프로그래머>인공지능(AI)|인터넷·IT·통신·모바일·게임>응용프로그래머> Python|인터넷·IT·통신·모바일·게임>웹프로그래머>백엔드
https://kr.indeed.com/viewjob?jk=413dacbda91de265,페임유니버스,"프론트엔드, 웹개발 외 신입/경력 정규직",서울 강남구,,"력사항: 학력무관직무기술: 개발, 웹 프론트엔드, 프론트엔드개발, 웹 엔지니어, JAVA개발, app개발, Python, 웹UI, 게임 UI, UI개발, UX기획, 스마트기기UI/UX 0 명 근무조건 고용형태: 정규직(수습기..."
https://kr.indeed.com/viewjob?jk=4ce79aa71969b913,Nexon,[인텔리전스랩스] 탐지응용팀 백엔드 개발자 (Python/Go),경기도 성남,,"투명하게 원인을 파악하고 수정할 수 있는 환경 구축 (AWS 기반) 지원자격 - Linux 환경에서 Python, Go, C++, Scala 중 한 가지 이상의 언어로 능숙한 개발이 가능하신 분 - 클라우드 환경(AWS..."
